gt_s,gt_p,gt_o
tom bradley,joined,london midland scottish railway company junior clerk goods depot
london midland scottish railway company,exists,kettering
muslims,strictly maintain that jesus,human being
muslims,strictly maintain that jesus was loved by,god
muslims,strictly maintain that jesus was exalted to ranks of the most righteous by,god
hezbollah,launched,series raids
series rocket attacks raids,killed,three israeli soldiers
series rocket attacks raids,captured,further two israeli soldiers
workers,addressed,dr cheddi jagan janet jagan leaders giwu
workers,a,strike
us 258 nc 122,parallel,river north before two routes diverge
two routes,diverge,northeast tarboro
number rare endemic,adapted to,unique limestone limestone mountains
these,include,any assistant president
he,batted 260 in 64 games with a 535 slugging percentage,primarily second base
border,between,shrewsbury township penn township
villages,generally physically separated from,industrial sites
mclay,also suggests that the songs negate,what many consider be heretical ending comedy
many,consider a comedy ending,heretical
thermal relief valves,generally characterized by,relatively small size valve necessary provide protection excess pressure caused thermal expansion
it,becomes,progressively understood god desires man s observance jewish precepts
occurs,this form of violence,domestic relationships involving two women
st james infirmary sad mood i ve just got forget you,produced,november 12 1960
23 8 all households,made up of,individuals
continuing duties specified freed slaves,may have,customary
he returned cleveland,working in clubs as a,singer
he returned cleveland,working in clubs as a,dancer
he returned cleveland,working in clubs as a,comedian
voyslava,killed,yaromir s bride
equality between two vectors homogeneous coordinates,means that,numbers right side are equal numbers left side
numbers right side numbers left side,equal up to,some common scaling factor formula 8
kilmacud crokes,knocked out of,competition semi final stage
previous champions,knocked out of,competition
300 soldiers,of,1st ss battalion
pair,developed,idea running workshops professional artists
was assassinate,plot,hitler
work,not allowed,public staging
michael,furious at,being passed over again
another job,with,rival company
graves,a disagreement with,representative sam graves
bond,apologized,u s justice department report cited bond forcing graves out over disagreement representative sam graves
pavarotti organ nickname,for,marketing
he stephanie,grow even closer,during point which robin ariana were unable see each other
agen,would,another successful run
plans artificially oxygenate areas baltic have experienced eutrophication,been proposed by,university gothenburg
eutrophication,experienced in,areas baltic
overseas teams,would return to,russia
st michael,honored,river being named him
berthings,found on,sailboats
heads,found on,sailboats
tiddas,koori english for,word sisters
personnel,mobilized,during korean war
squadrons,mobilized,during berlin crisis
these skills,readily proven when,squadrons were mobilized recalled back active duty
his son,killed before he could complete,human powered flying machine
single,features performances by,jasmine roy
hall effect,continues to,influential
hall effect,continues to be influential in,theories about topological order
statue sir arthur,erected,overlooking ottawa river
mccreadie,indicated in,proposed amendment party s constitution delegate hold early leadership review tim hudak
proposed amendment party s constitution,to hold an early leadership review of,tim hudak
he,died suddenly,1879
they,point to,other easy learn languages which have had deleterious effects minority languages
club policy,to promote into the senior team,talent
department aerospace engineering,at,i i t madras
small nominal ground rents,payable,annually
method,relies heavily on,inductive logic seeking show his christian beliefs fit best evidence
he was,relying heavily on,inductive logic show his christian beliefs fit best evidence
he was,using,method method relies heavily inductive logic
method,relies heavily on inductive logic seeking to show that,his christian beliefs fit best evidence
method,relies heavily on inductive logic seeking to show that his christian beliefs fit,best evidence
legislation sponsored sweeney signed law,provides,state pensions surviving family members police firefighters emergency services workers who die line duty
legislation sponsored sweeney signed law,provides state pensions to,surviving family members police firefighters emergency services workers who die line duty
legislation sponsored sweeney signed law,removes,remarriage prohibition receive death benefits spouses police officers firefighters killed while serving public good
law,provides state pensions to,surviving family members police firefighters emergency services workers who die line duty
he,born to,afro guyanese parents
he,of,afro guyanese descent
he,sold an index visible filing system to,kardex rand
community empowerment networks,networks of,collection local voluntary organisations groups
most davis big r b sellers,produced,willie henderson
most davis 25 singles,produced,willie henderson
protocol,includes,support groups
patients who do not recover quickly,the protocol also includes,psychotherapy
charles delay declaring war,leading shaftesbury to support,resolution house commons providing immediately disbanding army charles was raising
shaftesbury,supported,resolution house commons providing immediately disbanding army charles was raising
kormoran,the last axis surface raider to enter,australian waters
kormoran,the only axis ship to conduct attacks,australian waters
axis ship,conducted attacks,australian waters
axis surface raider,entered,australian waters
glasgow royal concert hall,in,scotland
usher hall,in,scotland
aberdeen music hall,in,scotland
perth concert hall,in,scotland
eden court inverness,in,scotland
new york city,iconic as,city melting pot
many ethnic groups,live in,city melting pot
many ethnic groups,live in,new york city
specific neighborhoods,such as,chinatown
specific neighborhoods,such as,little italy
chinatown,in,new york city
little italy,in,new york city
chinatown,in,city melting pot
little italy,in,city melting pot
specific neighborhoods,in,city melting pot
his father,able,start business
his father,able to start,business
church,undergone,radical transformation
church,of,medieval origin
church,a,building
callaghan s decision japanese pilot s funeral,would receive praise,years later
culture,fully reflected in the capital city in respect of,literature
culture,fully reflected in the capital city in respect of,religion
culture,fully reflected in the capital city in respect of,national dress code
culture,fully reflected in the capital city in respect of,music
culture,fully reflected in the capital city in respect of,dance
culture,fully reflected in the capital city in respect of,media
very different sta,converted into,flightworthy orbiter re designated ov 099 christened challenger
flightworthy re designated sta,christened,challenger
font,contains,many largely recognized shapes
recognized world symbols,such as,star david
recognized world symbols,such as,symbols zodiac
recognized world symbols,such as,index signs
recognized world symbols,such as,manicle signs
recognized world symbols,such as,obscure ampersands
sikorsky,says that,team dysfunctionality did not cause problems comanche
boeing,says that,factors outside their control caused problems comanche
boeing,says that,team dysfunctionality did not cause problems comanche
video concert hall,ran daily on,usa network seemingly arbitrary schedule
video concert hall,ran daily on usa network from 1978 to 1981 on,seemingly arbitrary schedule
video concert hall,ran daily on usa network from 1978 to 1981 on a seemingly arbitrary schedule,appearing early morning daytime late night early evening timeslots alike durations ranging one four hours
she,in,scarpetta factor
wesley,in,scarpetta factor
maoists nepal,according to available information have well established linkages with,indian revolutionary communist organizations
maoists nepal,according to available information have well established linkages primarily with,communist party india
maoists nepal,according to available information are leading,protracted people s war
its objective is,the enhancement of skills and competitive strength of,faculty staff m phil phd students
continuous capacity building professional development training sessions,for enhancement of skills and competitive strength of,faculty staff m phil phd students
word rape,spelled out in,center scrabble board
photograph two grinning boys playing board game scrabble word rape spelled out center board,prominent,company s sales flyer
canal de l ourcq,built,centuries later
omega beam,a form of that he fires from,his eyes
omega beam disintegrating energy,capable of transmuting,organisms
omega beam disintegrating energy,capable of erasing,organisms
omega beam disintegrating energy,capable of resurrecting,organisms
cotton production industries,in,kabul
carpet production industries,in,kabul
any event,that would minimize such a surface,entropically favored
latchford viaduct,opened to carry,london north western railway s stockport warrington line over manchester ship canal
group,included,peter engelmann william frankfurth
king james i,in,britain
greek pagans,saw their relations with the gods in,political terms
greek pagans,saw their relations with the gods in,social terms
roman pagans,saw their relations with the gods in,social terms
greek pagans,relations with,gods
greek pagans,scorned,man who constantly trembled fear thought gods
man,trembled with fear as a slave might fear a cruel and capricious master at,thought gods
neighborhood,comprises,older residential harbor front area
author bill bryson,suggests,siddal may have suffered poisoning because she was devoted swallower fowler s solution so called complexion improver made dilute arsenic
it,expected that,redevelopment work remaining subway would probably obliterate what remains exist
several members blick family,buried at,three rivers cemetery
burnham,survived,shangani patrol massacre
montana cowboy,survived,shangani patrol massacre
this,usually caused by,interacting inductive capacitive elements oscillator
final panel series,shows her with,mask similar madame masque
final panel series,shows her angrily refusing to see,spider man
she,shown with,mask similar madame masque
he,been at,battle granicus river
hoechst 33342,exhibits a 10 fold greater cell permeability than,h 33258
boss,usually,considerably larger regular enemies
boss,usually,considerably tougher regular enemies
kesey s son zane,asked to put on a 40th anniversary of his father s acid tests,matthew rick
kesey,father of,zane
his father s acid tests,will be having,40th anniversary
derek stevens,announced a kickstarter to fund,50th anniversary furthur bus trip
zane,announced along with,friend derek stevens
donors,offered,chance ride 50th anniversary furthur bus trip
he,sent to the united states to live with,foster family
he,sent to the united states to live with a foster family through,outreach program
he,a,foster family
municipality,renamed in honor of,american congressman william jones
tsar,chose to accept the draft authored by peter kharitonov as,basis new constitution
tsar,chose to accept,draft peter kharitonov basis new constitution
tsar,chose to accept as the basis for the new constitution,draft authored peter kharitonov
alcand street,in,st kilda
single dress rehearsal salzburg,in order that,invited audience could hear work performed
byers,criticizes,potential implications provide support ruthlessly capitalist economic system now dominates planet
he,also able to more easily control,his animal instincts
zomercarnaval,the second largest,caribbean carnival
zomercarnaval,in,europe
german english academy building,in,downtown milwaukee
no certain documentary evidence,there,he saw active service soldier scottish forces netherlands later 1570s
third row seats,in,pathfinder model
us 258 two state highways,cross the tar river on the freeway then exit,us 64
us 258,cross,tar river freeway then exit us 64 onto mutual boulevard
two state highways,cross,tar river freeway then exit us 64 onto mutual boulevard
two state highways,cross,tar river
charles,concerns about being able to declare,his belief all dogmas church england
use high ranking anonymous sources,caused,plame affair
use high ranking anonymous sources,caused,numerous scandals bush administration
plame affair,a,scandals bush administration
walsh act form,of,municipal governance
rare books,from,18th century
clathrate like baskets surrounding them,merge,when two such hydrophobic particles come very close
division,been fairly safe for,national party
northern terminus section,at,senai airport interchange
northern terminus section,near,senai airport
it,necessary to climb,embankments
climbing embankments,necessary to cross,some roads where former bridges have been filled
former bridges,been filled in,some roads
butters drive canberra suburb phillip,named,his honour
tampa,in,florida
think tank,at,university south florida tampa florida
she,unsuccessfully proposed to,city council
fast gun clubs,do not operate based upon,loose confederation
majority population leigh,born in,england
voorhees,approved a plan for an 850 000,artificial turf field
producer leo graham,collaborated with davis for,turning point
columbia,a,major record label
remaining trackage,at,charles city
unexpected deaths,result directly,from this
positive matter,of,new york city
matter,positive,new york city
he,became,first code crosser play test rugby league australia second time
work,introduced,fstack protector flag
work,introduced,fstack protector all flag
fstack protector all flag,protects whether they need it,all functions
rivalries between all clubs,in general,friendly
families,switch depending on,which clubs offered preferred services
families,switch depending on,which clubs offered preferred events
regulations meant,would be restarted from,race
trail crew,help maintain,seventeen dartmouth
somali sultans controlled region,such as,yusuf ali kenadid
somali sultans controlled region,such as,boqor osman mahamuud
somali sultans controlled,such as,mohamoud ali shire
european powers,gained a foothold through the signing of,various pacts agreements somali sultans then controlled region
powers gained foothold somalia,in,europe
her development,as,person
undercover cop muscles,enlists,his childhood friends travel japan help him catch yakuza group
undercover cop muscles,enlists his childhood friends to,travel japan help him catch yakuza group
undercover cop muscles,enlists his childhood friends to travel to japan to help him catch,yakuza group
they don t possess eyelids so,they must lick their,eyeballs clean order keep them moist
colonial elite,in,virginia
its support high bit depths which can be required film work,the main reason for,adoption over mainline gimp
systems thinking,concerns an understanding of a system by examining,linkages between elements compose entirety system
settlers,in,north carolina piedmont
their purpose,to be fair to,both parties
disallowing raising allegations without basis provable fact,fair to,both parties
they,disallowing the raising of allegations without,basis provable fact
people,that can be classified using this title include,vice president cabinet secretaries
people,classified using this title include,vice president
people,classified using this title include,cabinet secretaries
people,using this title include,vice president
people,using this title include,cabinet secretaries
popular internet reviewers redlettermedia,drawing negative comparisons of the film to,three stooges
popular internet reviewers redlettermedia,drawing negative comparisons of the film to,looney tunes
popular internet reviewers redlettermedia,drawing negative comparisons of the film to,home alone
wild radish seeds oil,a,potential source biofuel
korean villagers,hiding,resistance fighters
korean villagers hiding resistance fighters,often dealt with,summary execution
korean villagers hiding resistance fighters,often dealt with,rape
korean villagers hiding resistance fighters,often dealt with,forced labour
korean villagers hiding resistance fighters,often dealt with,looting
villagers hiding resistance fighters,in,korea
morning show host ryan cameron,lobbied for,frequency change whta
morning show host ryan cameron,put together a petition from listeners at,risk losing his job under radio one s management
morning show host ryan cameron s job,under,radio one s management
lletty shenkin explosion 1849,led to demands for,improved safety mines
manoeuvre tanks,would operate in depth as,strategic cavalry
numerous road shows,toured,country
lugo lozano,released and continue to reside in,venezuela
inmates,executed in,virginia
inmates,executed in,california
inmates,executed in,texas
mobile carrier task force,launched heavy air strikes against,japanese home islands
new york city subway,opened,city
god trinity,accepted by,vast majority christians
god single entity,not accepted by,vast majority christians
springsteen,vague,about details
moderate earthquakes,hit,within ten years
nine goals,excellent for,player who mainly featured defence
britain s relationship spain,slowly declined,during 1730s
inge,walks through the fields to,olaf s house
inge,walks to,olaf s house
show,designed to appear,if viewer was channel surfing through multi channel wasteland
test tvn24 hd,started on,30 november 2012
australia,a,high court
lead single,a,soft melodic song
graner,left handcuffed to,him
childers s biographer andrew boyle,noted,next ten years childers s book remained most powerful contribution any english writer debate britain s alleged military unpreparedness
felicia,like,most incarnations
tom mcmorran,exists,august 1994
autostereoscopy,any method of,displaying stereoscopic images without use special headgear part viewer
chapters bremen cathedral,located,district extraterritorial status around cathedral st peter
part administration bremen cathedral,located,within city boundary
part administration bremen cathedral,located,district extraterritorial status around cathedral st peter
district immunity status,around,cathedral st peter
district extraterritorial status,around,cathedral st peter
city council,would refrain to interfere,district extraterritorial status around cathedral st peter
necro,teaming to defend against,human tornado his allies
they,a large range of,possible power supplies
he,played in the final for,kangaroos
all four matches,including,final
22 2 families,living below,poverty line
23 8 population living below poverty line,including,15 8 under eighteens
23 8 population living below poverty line,including,37 5 those over 64
belfry,thoroughly renovated,2006
clitheroe rural district,part of,ribble valley district
cen,forms,important part local strategic partnership
he,became the youngest mayor in pittsburgh s history at,age 26
common name logo programming schedule,followed with the establishment of the,tv8 network between three stations
cooling center,a temporary,air conditioned public space set up local authorities deal health effects heat wave
cooling center,a temporary air conditioned public space set up by,local authorities deal health effects heat wave
manifold,prime,if it can not be presented connected sum more one manifold none which is sphere same dimension
mid march 2002 court order stop printing three months,evaded by printing under,other titles such not respublika
motorcycle speedway long track meeting,staged at ammanford,one few held
few long track motorcycle speedway meetings,held in,uk
partial list turbomachinery may use one more centrifugal compressors within machine,listed,here
samaritans,the guardians of,true israelite religion
tunnel,in,victoria
tunnel,in,waterloo
colonials,found,primitive lush vibrant new world
many republicans,arrested in,free state round ups
digital clock,inset into,front cover
free bible,will be given to,each habitat humanity s new homeowners
it,becomes clear that,microbe can not survive outside narrow ph range
french kings,sent commissioners to the provinces to inspect on,royal administrative affairs
armah,contrasts,materialism
armah,contrasts,corruption
armah,contrasts,dreams
armah,contrasts the two worlds of,corruption dreams
armah,contrasts the two worlds of,integrity social pressure
absolute accuracy measurement requires functionality calibration,true for,all sensors
sandy,in,wind door
more descriptive name,sought as,part several efforts have gypsy horse recognized breed outside romanichal community
several efforts,to have recognized,gypsy horse breed outside romanichal community
gypsy horse,recognized as a breed,romanichal community
pearson international airport,in,toronto
ballard,discovers that the spirits are attacking them as they believe that,humans plan exterminate humans mars
alliance,plays a significant role in islamic ethics because of,muhammad s role its formation
bruce,a,justice lord counterpart
bruce s justice lord counterpart,happily married until,wonder woman s justice lord counterpart killed him
wonder woman,a,justice lord counterpart
practice government interest costs rather,truly canceling government debt and can result in,hyperinflation if used unsparingly
then,she was raising not only her own children but also her nephews who had,orphaned plague
simpson,returned to,his mansion had surrendered police
ethics committee complaint,filed over,bond s role ouster graves
eisner,worked at,angel orensanz foundation norfolk street
angel orensanz foundation,on,norfolk street
beuerlein,red hot despite,below freezing temperatures
opposing attitudes love,found,throughout play
each time cluemaster,starts some new plan,stephanie dons her costume again
pornography involving sex between women,been predominantly produced by,men
pornography involving sex between women,been predominantly produced for,male female audience
miami canal,dug,bypassing rapids
player,must shoot constantly at a continual stream of enemies,order reach end each level
hawker pacific aerospace,offers,landing gear all major aircraft types
he,took 7 for 39 wickets against,sargodha
he,took 6 for 44 wickets against,sargodha
he,appeared alongside,his arsenal midfield colleague brian marwood
brian marwood,in,arsenal midfield
he,in,arsenal midfield
he,defines wild cards as,low probability high impact events were they occur would severely impact human condition
group neo arcadians surrounding him,ending,game
he,left his,old company expand his career something bigger
alexander,left only,small contingent
alexander,destroyed,entire army lay ahead
he,became a,famous inventor
he talked mcgee,about,using his name
hilf al fudul,a alliance created by various meccans including,islamic prophet muhammad establish fair commercial dealing
hoechst,quenched,33342 33258
hofmann,electronics chemistry stamp coin collecting,high school student
fbi director clive anderson,the same kind of avuncular superior as,chief brandon
strong population growth,reduced it to,more coastal based division
strong population growth,reduced it to,more urbanised division
lord chancellor,died,1867
komo news photographer,discovered,way develop color film new process took just few hours instead days
komo news photographer,discovered,way develop color film new process
barrie,directed by,lee grant television movie use hall
barrie,directed by,lee grant television movie use hall charlotte
lesley ann warren,in,79 park avenue
san francisco,a city in,america
marcus perperna,mentioned as,one consulars who bore testimony behalf marcus aemilius scaurus his trial
motto dieu et mon droit,to say,god my whole body law
dieu et mon droit,in,french
samaritans,called in jewish hebrew,shomronim
samaritans,call themselves in samaritan hebrew,shamerim
byrom street cutting,confirmed an unhitching point for,trains being cable hauled edge hill via victoria tunnel
trains,being cable hauled to,edge hill
only two people exposed pathogenic extraterrestrial microbe,survive,andromeda strain
holkins,stated that,he reserved right bring carl back any time krahulik goes france
language,occupies in a typical case of substrate interference,given territory
another language b,arrives in a typical case of substrate interference,same territory
john cecil masterman chairman twenty committee,commented,if example st paul s cathedral were hit it was useless harmful report bomb had descended upon cinema islington since truth would inevitably get through germany
johns,took the role of,senior nazi ss officer adolf eichmann 1986 television series war remembrance
purpose creation explanation,that,god desired dwelling place lower realms
mundane lowest world,transformed into,abode god s essence
4l,a,skyhawk
it,uses to communicate by making drumming noises,long slender scaly tail
numbers,inclusive of any of,childminders own children
it,chosen because it was a,triangulation station
it,named for,officer gen eleazer wheelock ripley who was mainly remembered battle lundy s lane siege fort erie
james arthur hogue,in,us
james arthur hogue,entered princeton university by posing as,self taught orphan
new warworld,detonated,next anti monitor
yellow central power battery,detonated,next anti monitor
shield,created to contain,explosion
new warworld,contained by,shield created hundreds green lanterns
yellow central power battery,contained by,shield created hundreds green lanterns
