sent_id,sentence,perseus_preds,perseus_TP,perseus_FP
sent_0411,After this point many of the republicans were arrested in Free State `` round ups '' when they had come out of hiding an,3,1,2
sent_0412,"Although Knievel broke his arms , he was more distraught over a permanent injury his accident caused to the cameraman .",4,1,3
sent_0413,"Although under constant attack from kamikazes as well as fighters and dive-bombers , `` Hazelwood '' came through the in",2,2,0
sent_0414,An animal that cares for its young but shows no other sociality traits is said to be `` subsocial '' .,2,1,1
sent_0415,An original limited artist edition of 250 was published in 1989 and was an oversized fine press slip-cased book with sta,6,1,5
sent_0416,And ABS has formed a partnership with Habitat for Humanity to give a free Bible to each of its new homeowners in the Uni,6,3,3
sent_0417,And he was in Ali 's army in the Battle of Jamal and later it was Muhammad ibn Abu Bakr who escorted Aisha back to Madin,7,2,5
sent_0418,"Andrea Bianco 's atlas of 1436 comprises ten leaves of vellum , measuring , in an 18th-century binding .",3,3,0
sent_0419,"Apartment buildings , shops , medical clinics , cinemas etc. were built in close proximity to the MAZ plant , providing ",3,3,0
sent_0420,Applications can use this service to record activity for a production system while implementations of other OSIDs can us,8,3,5
sent_0421,Applying this technique facilitates the connection of the center of the foot with the lower abdomen .,4,1,3
sent_0422,"As Attorney General he clashed with Daniel O'Connell when he insisted , against O'Connell 's wishes , on the appointment",4,3,1
sent_0423,"As a group , the team was enshrined into the Basketball Hall of Fame in 1959 .",6,2,4
sent_0424,"As a result , it becomes clear that the microbe can not survive outside a narrow pH range .",2,1,1
sent_0425,"As a result , the lower river had to be dredged three times in two years .",2,1,1
sent_0426,"As early as the 15th century , the French kings sent commissioners to the provinces to inspect on royal and administrati",5,2,3
sent_0427,"As in his first novel , Armah contrasts the two worlds of materialism and moral values , corruption and dreams , two wor",1,1,0
sent_0428,"As is true for all sensors , absolute accuracy of a measurement requires a functionality for calibration .",3,1,2
sent_0429,"As of `` A Wind in the Door '' , Sandy aspires to become a banker , on the grounds that it is practical and lucrative .",2,1,1
sent_0430,"As part of several efforts to have the Gypsy Horse recognized as a breed outside the Romanichal community , a more descr",5,1,4
sent_0431,"Assisting in the recording process were Fernando Cabello and two friends of the group , Eva Dalda and Lydia Iovanne .",3,3,0
sent_0432,"At a presentation in the Toronto Pearson International Airport hangar , Celine Dion helped the newly solvent airline deb",2,1,1
sent_0433,"At least 11 villagers disappeared and 8 people were killed in the ensuing tsunami , two of which are prisoners at one of",4,1,3
sent_0434,"At no cost to the parents , these services are provided in compliance with state and federal law ; and are reasonably ca",3,2,1
sent_0435,"At one point , Ballard is nearly possessed , but resists when she is given a drug and discovers that the spirits are att",6,6,0
sent_0436,"Barbara , however , unable to leave behind her vigilante life , fought a mugger and ultimately miscarried her child .",1,1,0
sent_0437,"Because Yesler Way marks the boundary between two different plats , the street grid north of Yesler does not line up wit",1,1,0
sent_0438,"Because of Muhammad 's role in its formation , the alliance plays a significant role in Islamic ethics .",5,4,1
sent_0439,"Because of his talents and training , Beast can outperform any Olympic-level athlete , contorting his body and performin",8,4,4
sent_0440,Bruce 's Justice Lord counterpart was happily married to Wonder Woman as well until her Justice Lord counterpart killed ,1,1,0
sent_0441,"Burnham died of heart failure at the age of 86 , on September 1 , 1947 at his home in Santa , Barbara , California .",5,2,3
sent_0442,"But this practice simply reduces government interest costs rather than truly canceling government debt , and can result ",2,2,0
sent_0443,"By then , she was raising not only her own children but also her nephews , who had been orphaned by the plague .",0,0,0
sent_0444,"By this point , Simpson had returned to his mansion in Brentwood and had surrendered to police .",2,2,0
sent_0445,Byers states that global citizenship is a `` powerful term '' because `` people that invoke it do so to provoke and just,9,2,7
sent_0446,"Carl uses the `` old magic '' to tame the Deep Crow , claiming it is not his `` first time to the rodeo . ''",0,0,0
sent_0447,Certain fractional quantum Hall phases appear to have the right properties for building a topological quantum computer .,21,1,20
sent_0448,Chevalier fulfilled his promise the following year by erecting a shrine dedicated to the honour of Mary under the title ,4,4,0
sent_0449,Cis-regulatory elements are sequences that control the transcription of a nearby gene .,6,1,5
sent_0450,Citizens for Responsibility and Ethics in Washington filed an Ethics Committee complaint against Bond over his role in t,4,2,2
sent_0451,"Combined with appropriate match pellets these rifles produce a consistent 10 ring performance , so a non-maximal result ",9,4,5
sent_0452,"Curley was the first classical organist to perform a solo organ recital at the White House , and also played before seve",2,1,1
sent_0453,"DC Comics held a memorial service in Manhattan 's Lower East Side , a neighborhood Eisner often visited in his work , at",7,3,4
sent_0454,"Despite the below-freezing temperatures , Beuerlein was red-hot , out-dueling Brett Favre and connecting on 29 of 42 att",5,3,2
sent_0455,"Dodo was originally intended to have a `` common '' accent , and is portrayed this way at the end of `` The Massacre '' ",4,3,1
sent_0456,"Dr. Pim played for Ireland against England in 1892 , 1893 , 1894 and 1896 .",6,2,4
sent_0457,"Due to the opposing nature of the two songs , they can be viewed as a debate on the opposing attitudes on love found thr",8,4,4
sent_0458,"Due to the transmitter location being based in Tyrone and a smaller signal wattage , it was barely hearable in the north",6,3,3
sent_0459,"During the Second World War , the number of Turkish run cafes increased from 20 in 1939 to 200 in 1945 which created a d",4,3,1
sent_0460,During the morning and evening rush hours some services run direct to/from Paddington and Reading .,3,3,0
sent_0461,"During the off-season the ACT Rugby Union was renamed the ACT and Southern NSW Rugby Union , and the name of the team wa",12,12,0
sent_0462,Each of the Matoran brought their Toa stone and met each other at the Great Temple .,5,3,2
sent_0463,"Each time Cluemaster escapes or starts some new plan , Stephanie dons her costume again .",3,2,1
sent_0464,Erotica and pornography involving sex between women have been predominantly produced by men for a male and female audien,2,2,0
sent_0465,Failure to perform the duty could lead to prosecution at law and re-enslavement .,2,2,0
sent_0466,"Falun Gong 's teachings are compiled from Li 's lectures , and Li holds definitional power in that belief system .",2,2,0
sent_0467,"Fans reacted to the news of the suspension by canceling their XM Radio subscriptions , with some fans even going as far ",1,1,0
sent_0468,"From 1909 to 1912 , the Miami Canal was dug , bypassing the rapids at the head of the North Fork .",2,1,1
sent_0469,"From the start of the first semester of 2010 , the University banned smoking on any of its property , including inside a",12,2,10
sent_0470,"Furthermore , knowledge and interest pertaining to the event , as well as the level of importance , contribute to the fr",0,0,0
sent_0471,Gameplay is very basic ; the player must shoot constantly at a continual stream of enemies in order to reach the end of ,8,2,6
sent_0472,"Gavin Hood is a South African filmmaker , screenwriter , producer and actor , best known for writing and directing the A",4,4,0
sent_0473,"George Bluth Sr. , patriarch of the Bluth family , is the founder and former CEO of the Bluth Company which markets and ",6,6,0
sent_0474,"Godzilla and Battra battled on the ocean floor , until they caused a rift to open between tectonic plates .",4,3,1
sent_0475,"Good 1H NMR spectra can be acquired with 16 repeats , which takes only minutes .",3,3,0
sent_0476,"HTB 's aim is for an Alpha course to be accessible to anyone who would like to attend the course , and in this way HTB s",4,1,3
sent_0477,"Hapoel Lod played in the top division during the 1960s and 1980s , and won the State Cup in 1984 .",4,2,2
sent_0478,"Having been directed to found a monastery of his order in the United States in 1873 , Fr .",1,1,0
sent_0479,Hawker Pacific Aerospace is a MRO-Service company which offers landing gear and hydraulic MRO services for all major air,12,1,11
sent_0480,He also possesses enhanced senses and can track people for great distances over open terrain and his feet are sensitive ,9,4,5
sent_0481,"He also took 124 wickets , with 7 for 39 and 6 for 44 against Sargodha in 1962-63 his best bowling figures .",10,1,9
sent_0482,"He appeared in that game alongside his Arsenal midfield colleague Brian Marwood , who had joined them from Sheffield Wed",6,2,4
sent_0483,"He defines Wild Cards as ` Low Probability , High Impact events that , were they to occur , would severely impact the hu",8,2,6
sent_0484,"He finds himself in a desert as a group of Neo Arcadians surround him , ending the game .",5,2,3
sent_0485,He had spent 11 years in jail despite having been acquitted twice .,5,2,3
sent_0486,"He is idolized , receiving the name of `` God '' .",1,0,1
sent_0487,"He left his old company , V2 records , wanting to expand his career into something bigger .",2,0,2
sent_0488,"He left only a small contingent to guard the defile , and took his entire army to destroy the plain that lay ahead of Al",5,4,1
sent_0489,"He lodged near the hospital at 28 St Thomas 's Street in Southwark , with other medical students , including Henry Steph",7,6,1
sent_0490,He played Perker in the 1985 adaptation of `` The Pickwick Papers '' .,1,1,0
sent_0491,"He represented the riding of Nickel Belt in the Sudbury , Ontario area .",4,3,1
sent_0492,"He talked to McGee about using his name and received permission , which is confirmed by correspondence between McGee and",4,3,1
sent_0493,"He was a member of the European Convention , which drafted the text of the European Constitution that never entered into",1,1,0
sent_0494,He was buried in the Abbey of the Psalms mausoleum at the Hollywood Forever Cemetery .,2,1,1
sent_0495,"He was subsequently reprieved for a month , and then again for a week .",2,1,1
sent_0496,"Her image held aloft signifies the Earth , which `` hangs in the air '' .",2,2,0
sent_0497,"Hilf al-Fudul was a 7th-century alliance created by various Meccans , including the Islamic prophet Muhammad , to establ",4,2,2
sent_0498,"Historically , Aiseau was a village dedicated to agriculture , logging , but also to the industry .",4,3,1
sent_0499,"Hoechst 33342 and 33258 are quenched by Bromodeoxyuridine , which is commonly used to detect dividing cells .",3,2,1
sent_0500,"Hofmann was a below-average high school student , but he had many hobbies including magic , electronics , chemistry , an",6,0,6
sent_0501,"However , after pressure campaigns from various human rights groups , BAE Systems recently stated it no longer produces ",4,1,3
sent_0502,"However , comic relief sidekick `` Mike McGurk '' bears some resemblance to Tracy 's partner from the strip , Pat Patton",9,3,6
sent_0503,"However , during his rehearsal , Knievel lost control of the motorcycle and crashed into a cameraman .",4,3,1
sent_0504,"However , it became far less safe for the Nationals from 1983 onward , and strong population growth over the last three ",3,1,2
sent_0505,"However , when the antigenicities of the seed strains and wild viruses do not match , vaccines fail to protect the vacci",2,1,1
sent_0506,"If given this data , the Germans would be able to adjust their aim and correct any shortfall .",3,2,1
sent_0507,"If the second excitation pulse is sent prematurely before the relaxation is complete , the average magnetization vector ",2,2,0
sent_0508,"In 1005 for example , the governor of the important Adriatic port of Dyrrhachium had surrendered the town to Basil II .",4,1,3
sent_0509,"In 1866 , he began a second term as Lord Chancellor , which ended with his death in the next year .",4,1,3
sent_0510,"In 1911 , with Francis La Flesche , she published `` The Omaha Tribe '' .",4,2,2
sent_0511,"In 1926 , `` The News and Courier '' was bought by the owners of Charleston 's main evening paper , `` The Evening Post ",2,1,1
sent_0512,"In 1954 , a KOMO news photographer discovered a way to develop color film in a new process that took just a few hours in",2,1,1
sent_0513,In 1964 Barrie appeared in two episodes of `` Alfred Hitchcock Presents '' .,1,1,0
sent_0514,"In 1972 , he won from Yakutpura and later in 1978 , again from Charminar .",5,5,0
sent_0515,"In 1972 , researchers found metallic conductivity in the charge-transfer complex TTF-TCNQ .",2,1,1
sent_0516,In 1975 Barrie was directed by Lee Grant in the television movie `` For The Use Of The Hall '' as `` Charlotte '' .,5,3,2
sent_0517,"In 1977 she appeared in two television films , as the mother of Lesley Ann Warren 's character in `` 79 Park Avenue '' a",1,1,0
sent_0518,"In 1987 , Rodan became president of the American Society for Bone and Mineral Research .",3,1,2
sent_0519,"In 1990 Kelsang Gyatso became also outspoken against the Geshe Studies Programme , and `` made the pursuit of his new pr",4,2,2
sent_0520,"In 2004 the Brumbies finished at the top of the Super 12 table , six points clear of the next best team .",4,2,2
sent_0521,"In 2006 they applied for National League Three , finishing in 5th place and qualifying for the play-offs , where they lo",2,2,0
sent_0522,"In 2007 , Sun announced `` Project Indiana '' with several goals , including providing an open source binary distributio",1,1,0
sent_0523,"In 2010 , scam websites co-opted a photograph of her to promote health treatments , the ubiquitous `` 1 weird old tip ''",6,5,1
sent_0524,"In 2011 , major vendors launched several consumer-oriented motherboards using the Intel 6-series LGA 1155 chipset and AM",2,1,1
sent_0525,"In 2012 , Bloomberg Businessweek voted San Francisco as America 's Best City .",3,2,1
sent_0526,"In 54 BC , Marcus Perperna is mentioned as one of the consulars who bore testimony on behalf of Marcus Aemilius Scaurus ",3,2,1
sent_0527,"In Canada , there are two organizations that regulate university and collegiate athletics .",1,1,0
sent_0528,"In French , `` droit '' can mean `` the whole body of the Law '' , as in the motto `` dieu et mon droit , '' which is to",9,5,4
sent_0529,"In Jewish Hebrew , the Samaritans are called `` Shomronim '' , while in Samaritan Hebrew they call themselves `` Shameri",1,0,1
sent_0530,"In Jewish belief , its fulfilment will be revealed in the cumulation of Creation , in the era of resurrection , in the p",6,1,5
sent_0531,"In June , Nasser took control of the interior ministry post from Naguib loyalist Sulayman Hafez , and pressured Naguib t",4,3,1
sent_0532,In October 2009 it was confirmed that the Byrom Street cutting was a hitching and unhitching point for trains being cabl,13,1,12
sent_0533,"In September 1941 , she joined the Women 's Auxiliary Air Force , working at the Department of the Chief of Air Staff as",5,3,2
sent_0534,"In Van Howe 's study , all cases of meatal stenosis were among circumcised boys .",1,0,1
sent_0535,"In `` The Andromeda Strain '' , Michael Crichton 's first novel published under his real name , only two people exposed ",5,0,5
sent_0536,"In a news post , Holkins stated that he reserved the right to bring Carl back any time Krahulik goes to France .",4,1,3
sent_0537,"In a typical case of substrate interference , a Language A occupies a given territory and another Language B arrives in ",4,1,3
sent_0538,"In addition , as John Cecil Masterman , chairman of the Twenty Committee , commented , `` If , for example , St Paul 's ",2,1,1
sent_0539,"In athletics , Boston College left the Big East Conference and joined the Atlantic Coast Conference on July 1 , 2005 .",5,3,2
sent_0540,In both cases this specialized function replaces the basic rifleman position in the fireteam .,2,1,1
sent_0541,"In its first six months , RCPO concluded 858 cases convictions in 88 % of cases .",5,2,3
sent_0542,"In modern classifications , it is often treated as a subfamily of the Glyphipterigidae family .",3,1,2
sent_0543,"In more recent years , this policy has apparently relaxed somewhat .",3,0,3
sent_0544,"In order to support planned TRAX expansion , UTA ordered 77 Siemens S70 light rail vehicles from Siemens AG .",2,2,0
sent_0545,"In particular , Cyprinidae of southwestern North America have been severely affected ; a considerable number went entire",2,2,0
sent_0546,"In the 1901 election , after which the Oppositionists under George Leake were able to form a minority government , Frank",4,3,1
sent_0547,In the 1960s and 70s most of Kabul 's economy depended on tourism .,4,4,0
sent_0548,"In the 1986 television series `` War and Remembrance '' , Johns took the role of the senior Nazi SS officer Adolf Eichma",4,2,2
sent_0549,"In the Civil War , he advocated strong prosecution of the Union War effort , the end of slavery , and civil rights for f",15,6,9
sent_0550,"In the Crimean War , the 5th Dragoon Guards formed part of the Heavy Cavalry Brigade and was sent to the Black Sea in 18",3,2,1
sent_0551,In the early 19th century the Welsh Methodists broke away from the Anglican church and established their own denominatio,3,2,1
sent_0552,"In the north and east inhabitants speak Bumthangkha , and in the extreme southeast Khengkha is spoken .",5,3,2
sent_0553,"In the winter of 1976 , Knievel was scheduled for a major jump in Chicago , Illinois .",3,1,2
sent_0554,In this explanation the purpose of Creation is that `` God desired a dwelling place in the lower realms '' - it is man w,4,2,2
sent_0555,"In those years , he began to collaborate with some newspapers .",2,1,1
sent_0556,"Initially flying the A-4B Skyhawk , the squadron later transitioned to the A-4L Skyhawk .",1,1,0
sent_0557,Initially his chances of surviving were thought to be no better than 50-50 .,2,2,0
sent_0558,"It has long hind legs and a long , slender , scaly tail that it uses to communicate by making drumming noises .",5,2,3
sent_0559,"It is essentially the same as the dialect spoken in Xiamen , and is unintelligible with Standard Chinese .",3,2,1
sent_0560,"It is not really passable , and must be done on foot if attempted .",2,2,0
sent_0561,It is part of the Surrey Hills Area of Outstanding Beauty and situated on the Green Sand Way .,2,2,0
sent_0562,It should be noted that these numbers are inclusive of any of the childminders own children .,1,0,1
sent_0563,It was chosen in 1901 because it was a triangulation station at the junction of the trancontinental triangulation arc of,9,0,9
sent_0564,"It was named for Gen. Eleazer Wheelock Ripley , an officer in the War of 1812 , who was mainly remembered for the Battle",5,2,3
sent_0565,"It was originally aimed at mature entrants to the teaching profession , who could not afford to give up work and underta",5,2,3
sent_0566,"Its cultivation even declined in favour of the Asian species , which was introduced to East Africa early in the common e",3,2,1
sent_0567,JAL introduced jet service on the Fukuoka-Tokyo route in 1961 .,5,2,3
sent_0568,James Arthur Hogue is a US impostor who most famously entered Princeton University by posing as a self-taught orphan .,2,1,1
sent_0569,"John Stewart and Guy Gardner brought down New Warworld and the Yellow Central Power Battery , which were detonated next ",2,2,0
sent_0570,"Johns also appeared as an Imperial Officer in the 1980 `` Star Wars sequel '' , `` The Empire Strikes Back '' .",7,3,4
sent_0571,Keats 's long and expensive medical training with Hammond and at Guy 's Hospital led his family to assume he would pursu,3,1,2
sent_0572,Keibler then asked for time off to appear on `` Dancing with the Stars '' .,3,2,1
sent_0573,"Kim graduated from Ballard High School in Louisville , Kentucky , in 1989 and from Oberlin College in Ohio in 1993 where",5,4,1
sent_0574,"Kostabi 's other releases include : `` Songs For Sumera '' , `` New Alliance '' and `` The Spectre Of Modernism '' .",0,0,0
sent_0575,Langford kept Walcott at a distance with his longer reach and used his footwork to evade all of Walcott 's attacks .,3,3,0
sent_0576,Language B then begins to supplant language A : the speakers of Language A abandon their own language in favor of the ot,7,4,3
sent_0577,"Lemmy believes that if Will Reid Dick had not been there , they could have worked through the problems , but ended up ex",0,0,0
sent_0578,Lens subluxation is also seen in dogs and is characterized by a partial displacement of the lens .,2,2,0
sent_0579,"Li Hongzhi began his public teachings of Falun Gong on 13 May 1992 in Changchun , and subsequently gave lectures and tau",8,3,5
sent_0580,"Like other BBC content of the mid-1990s , it often lampooned the low-budget quality of satellite television available in",4,2,2
sent_0581,Luke Robert Ravenstahl is an American politician who served as the 59th Mayor of Pittsburgh from 2006 until 2014 .,5,1,4
sent_0582,"Males had a median income of $ 28,750 versus $ 16,250 for females .",4,0,4
sent_0583,"Males had a median income of $ 36,016 versus $ 32,679 for females .",4,0,4
sent_0584,"Many are surgically removed for aesthetics and relief of psychosocial burden , but larger ones are also excised for prev",7,3,4
sent_0585,"Many overseas Chinese whose ancestors came from the Quanzhou area , especially those in Southeast Asia , often speak mai",8,3,5
sent_0586,"Meanwhile , the Mason City Division continued to operate as usual .",0,0,0
sent_0587,"Models , taking into account the size and room number of the barrack blocks in the Gorgan Wall forts and likely occupati",12,7,5
sent_0588,"Modern educational methods were more widely spread throughout the Empire , and the country embarked on a development sch",6,4,2
sent_0589,Modernity has been blended without sacrificing on the traditional Buddhist ethos .,0,0,0
sent_0590,Modification of the river began in earnest with the arrival of the Florida East Coast Railway in Miami in 1896 .,1,1,0
sent_0591,"Moore briefly dropped Marciano in the second round , but Marciano recovered and knocked Moore down five times , knocking",3,3,0
sent_0592,Much of the station remains in the disused subway but there is no public access .,0,0,0
sent_0593,"Newhan split the season between Triple-A Round Rock , where he hit .308 .",2,1,1
sent_0594,No announcement from UTV was made about the decision to close the station earlier than planned .,1,0,1
sent_0595,Noatak has a gravel public airstrip and is primarily reached by air .,2,1,1
sent_0596,Not everyone completely trusted Vakama 's vision - Matau was particularly frustrated at following what he considered the,4,3,1
sent_0597,"Nothing is known for certain about his life before about 1580 , but contemporary or near-contemporary accounts suggest t",5,3,2
sent_0598,"Obviously the epilogue was not an afterthought supplied too late for the English edition , for it is referred to in `` T",2,1,1
sent_0599,"Of the rest of the population , there was 1 individual who belonged to the Christian Catholic faith .",0,0,0
sent_0600,"On 16 June 1944 , British double agent `` Garbo '' was requested by his German controllers to give information on the si",23,4,19
sent_0601,"On May 13 , 2010 , Yost was named manager of the Kansas City Royals , replacing Trey Hillman .",4,2,2
sent_0602,"On May 15 , 2007 , XM suspended Opie & Anthony for 30 days , in response to a broadcast featuring a homeless man who wan",4,3,1
sent_0603,"On November 2 , 2005 , Brown ended his contract early and left the federal government .",2,2,0
sent_0604,"One candidate is a wreck at the western end of Manitoulin Island in Lake Huron , with another wreck near Escanaba , Mich",8,6,2
sent_0605,"One example could be `` Time '' , the fifth song from Pink Floyd 's 1973 album `` The Dark Side Of The Moon '' , which c",7,4,3
sent_0606,"Only Ballard and Williams are left after Sergeant Jericho and the other officers , along with the two train operators , ",7,3,4
sent_0607,"Opponents of religious freedom sometimes referred to it as `` Rogue 's Island '' , and Cotton Mather called it `` the se",3,3,0
sent_0608,"Originally , Hank McCoy retains the basic features of a normal human alongside a generally simian physiology equivalent ",1,1,0
sent_0609,"Other signs of lens subluxation include mild conjunctival redness , vitreous humour degeneration , prolapse of the vitre",0,0,0
sent_0610,Pakistan Chrome Mines Ltd. is a mining company incorporated in the Islamic Republic of Pakistan .,3,1,2
sent_0611,Parental investment is any expenditure of resources to benefit one offspring .,3,1,2
sent_0612,"Piffaro generally performs a concert series of four to five concerts a year in Philadelphia , in addition to touring thr",6,4,2
sent_0613,"Plants have been planted marking parts of the foundations of the castle , so the positions of some of the buildings can ",8,3,5
sent_0614,"Prior to the 2012 season , the Royals signed Yost to a contract extension through the 2013 season .",3,2,1
sent_0615,"Prior to the Playmaker tool , the Player could only call one of four available `` hot routes . ''",5,2,3
