sent_id,sentence,perseus_preds,perseus_TP,perseus_FP
sent_0206,"The final panel of the series shows her with a mask similar to Madame Masque , angrily refusing to see Spider-Man since ",2,2,0
sent_0207,"He had been at the Battle of the Granicus River , and had believed that Memnon 's scorched Earth strategy would work her",3,2,1
sent_0208,A very early form of vaccination known as variolation was developed several thousand years ago in China .,8,2,6
sent_0209,Hoechst 33342 exhibits a 10 fold greater cell-permeability than H 33258 .,1,1,0
sent_0210,"This releases some of the water molecules into the bulk of the water , leading to an increase in entropy .",2,2,0
sent_0211,"The Bears would have to wait until 2000 to play another international , when they played France in the lead-up to the 20",4,3,1
sent_0212,"Historical buildings and monuments in Meaux are mainly located in the old city , inside the old defensive walls , still ",6,3,3
sent_0213,This `` 1-in-200 year event '' flooded major intersections and underpasses and damaged both residential and commercial p,4,4,0
sent_0214,"At this point , the player confronts a boss , who is usually considerably larger and tougher than regular enemies .",3,1,2
sent_0215,"Arminius , leader of the Cherusci and allies , now had a free hand .",2,1,1
sent_0216,"In 2005 , Kesey 's son Zane asked a friend , Matthew Rick , also known as Shady Backflash , to put on a 40th anniversary",5,2,3
sent_0217,He further stated that Hauptmann looked different and that `` John '' was actually dead because he had been murdered by ,4,1,3
sent_0218,"In April 2014 , Zane , along with friend Derek Stevens , announced a Kickstarter to fund a 50th anniversary Furthur Bus ",6,2,4
sent_0219,"It includes thirty-two elementary schools , nine middle schools , ten high schools and one charter school .",8,4,4
sent_0220,Millais painted daily into the winter putting lamps under the tub to warm the water .,2,1,1
sent_0221,"Crime Master slashes her when he finds out about this , but before passing out , she alerts the FBI that he is in league",3,2,1
sent_0222,He was separated from his family as a young boy during the Cuban Revolution when he was sent to the United States to liv,11,1,10
sent_0223,"During the language shift , however , the receding language A still influences language B .",1,1,0
sent_0224,"In 1918 , the municipality was renamed Jones in honor of American congressman William Jones , who authored the Philippin",8,5,3
sent_0225,"The Tsar chose to accept the draft authored by Peter Kharitonov , Deputy State Secretary of the State Chancellory , as t",9,3,6
sent_0226,"In 1862 , Henry Letheby obtained a partly conductive material by anodic oxidation of aniline in sulfuric acid .",5,1,4
sent_0227,"The Crybaby is the twelfth album by Melvins , released in 2000 through Ipecac Recordings , and the last part of a trilog",6,2,4
sent_0228,Australian Amber Wing was the first woman to land a ts fs wake to wake 900 .,3,1,2
sent_0229,"The Prahran and Malvern Tramways Trust opened a line from Alcand Street , St Kilda to Hawthorn Road , Caulfield North al",2,1,1
sent_0230,"The doctor , Erasistratus , suspects love is behind Antiochus 's suffering .",2,1,1
sent_0231,"During the celebrations of his Silver Jubilee in November 1955 , Haile Selassie introduced a revised constitution , wher",5,2,3
sent_0232,"As a result , environmental factors are also understood to contribute heavily to the strength of intimate relationships ",2,2,0
sent_0233,"In line this with , Edwards 's early years , as seen in Comico 's graphic novel , were re-imagined in the comic book min",5,3,2
sent_0234,"The body was made largely of lightweight carbon fiber and Kevlar , known for its strength , and lightness .",5,3,2
sent_0235,"The Nazis did however permit a single dress rehearsal in Salzburg , conducted by Clemens Krauss on 16 August , in order ",9,6,3
sent_0236,"Byers does not oppose the concept of global citizenship , however he criticizes potential implications of the term depen",1,0,1
sent_0237,"Each of the programs uses a combination of funding priorities and geographic requirements to select grants , described o",5,2,3
sent_0238,"Local football team Ammanford A.F.C. play in the Welsh Football League Second Division , while rugby union team Ammanfor",4,3,1
sent_0239,He was also able to more easily control his animal instincts after this second mutation .,4,2,2
sent_0240,"A year later , he was appointed Attorney-General for Ireland and on this occasion was sworn of the Privy Council of Irel",6,4,2
sent_0241,"It hosts the `` Zomercarnaval '' , the second largest Caribbean carnival in Europe , originally called the Antillean car",3,2,1
sent_0242,Hence it can be represented by the integer notation .,1,1,0
sent_0243,"In 1891 , the academy moved to the German-English Academy Building in downtown Milwaukee .",3,1,2
sent_0244,"In England , emphasis was placed on the orientation of the chapels to the east .",1,1,0
sent_0245,On one occasion the lamps went out and the water became icy cold .,3,2,1
sent_0246,"He probably saw active service as a soldier for the Scottish forces in The Netherlands in the later 1570s , although the",2,1,1
sent_0247,The 2005 model introduced a third row of seats to the Pathfinder line for the first time .,3,2,1
sent_0248,"US 258 and the two state highways cross the Tar River on the freeway , then exit US 64 onto Mutual Boulevard at a partia",0,0,0
sent_0249,"A large gravestone was erected in 1866 , over 100 years after his death .",4,2,2
sent_0250,"Charles had concerns about being able to declare his belief in all the dogmas of the Church of England , so as well as h",5,3,2
sent_0251,"The use of high ranking , anonymous sources has caused numerous scandals for the Bush Administration , most notably the ",5,0,5
sent_0252,"It deals with cases of fraud in relation to direct taxes and indirect taxes , tax credits , drug smuggling , and money l",1,1,0
sent_0253,The Commissioner of Parks and Public Property heads one of the departments in those local governments in New Jersey that,3,3,0
sent_0254,"In England and Wales , as an `` attempt '' , attempted murder is an offence under section 1 of the Criminal Attempts Act",9,1,8
sent_0255,"Moreover , some sponsors pulled their advertising off XM in protest of the suspension .",5,3,2
sent_0256,"He is also known for his `` Aramata Collection '' , a private library housing thousands of rare books from the 18th and ",2,1,1
sent_0257,"For example , when two such hydrophobic particles come very close , the clathrate-like baskets surrounding them merge .",3,2,1
sent_0258,"Dr. Jagan himself was personally involved in the organization of the strike , and helped to raise funds across the count",6,3,3
sent_0259,"Historically , the division has been a rural seat and fairly safe for the National Party , which held it for all but six",15,3,12
sent_0260,"After leaving , he tried to find acting jobs and worked as an Elvis impersonator for a short time .",4,2,2
sent_0261,"Frowin founded the Benedictine monastery of New Engleberg at Conception , which was erected into an abbey in 1881 .",2,2,0
sent_0262,"The northern terminus of this section is at Senai Airport Interchange near Senai Airport , while it shares the same Kilo",3,2,1
sent_0263,He was appointed Commander of the Order of the British Empire in the 1948 Queen 's Birthday Honours and was knighted in ,3,2,1
sent_0264,In 2004 the Oxford English University Press included Makaton as a common usage word in the Oxford English Dictionary .,3,1,2
sent_0265,"He and his friends were said to have made bombs for fun on the outskirts of Murray , Utah .",2,1,1
sent_0266,"Montgomery Blair 's Science , Math , and Technology Academy specializes in : Life Science , Physical Science , Engineeri",6,5,1
sent_0267,It is necessary to climb embankments to cross some roads where former bridges have been filled in .,5,0,5
sent_0268,Butters Drive in the Canberra suburb of Phillip is named in his honour .,0,0,0
sent_0269,"Afterward he has joined Emma Frost 's Academy of Tomorrow , a school for gifted beings .",10,3,7
sent_0270,After this she became very ill with a severe cold or pneumonia .,2,1,1
sent_0271,"However , the term cob , defined as a short-legged , stout horse , is a body type rather than a breed .",3,2,1
sent_0272,"As she reads the articles , she also makes veiled references and innuendo relating to the slang use of `` beaver '' .",3,2,1
sent_0273,The origin of the Missionaries of the Sacred Heart is closely connected with the definition of the dogma of the Immacula,4,2,2
sent_0274,"Spielberger was formerly Chairman of the Psychology Department at the University of South Florida in Tampa , Florida and",2,1,1
sent_0275,"Hiester was born in Montgomery County , Pennsylvania on July 17 , 1749 , the son of German immigrants Daniel and Catheri",3,2,1
sent_0276,"He chose a path of confrontation , of conflict .",3,2,1
sent_0277,"The Aura spacecraft has a mass of about 1,765 kg .",2,2,0
sent_0278,"A dam on the creek has created a lake covering for fishing , boating , and swimming .",1,1,0
sent_0279,"The railways were separate , the S&D being administered by the Midland Railway and the London and South Western Railway ",4,4,0
sent_0280,X is revealed to be the leader of Neo Arcadia and Zero confronts X in battle .,4,3,1
sent_0281,"In 1577 , she unsuccessfully proposed to the city council that it should establish a home for poor women , of which she ",4,2,2
sent_0282,DePauw University awarded the degree `` Doctor of Divinity '' in 1892 .,5,1,4
sent_0283,"Unlike Fast Gun clubs , Big Gun clubs operate based upon a loose confederation , with each club reserving the ability to",5,3,2
sent_0284,"Standing in contrast to Descartes 's scientific reductionism and philosophical analysis , it proposes to view systems in",5,3,2
sent_0285,"The majority of the population of Leigh were born in England ; 2.10 % were born elsewhere within the United Kingdom , 0.",5,3,2
sent_0286,"But ex-slaves were able to own property outright , and their children were free of all constraint .",4,1,3
sent_0287,"At Vitoria and in Wellington 's invasion of southern France , Hill corps usually consisted of William Stewart 's 2nd Div",4,3,1
sent_0288,"When New Tomorrowland opened in 1967 , the space that this ride occupied was turned into the Tomorrowland Stage .",3,3,0
sent_0289,"There are 109 individuals who belong to another church , and 20 individuals did not answer the question .",2,1,1
sent_0290,"Hofmann was born in Salt Lake City , Utah .",2,2,0
sent_0291,"Voorhees approved a plan in 2010 for an $ 850,000 artificial turf field to be completed by 2011 .",5,3,2
sent_0292,All officers are additionally equipped with less-lethal weapons for use against threats that do not justify a firearms r,0,0,0
sent_0293,"Soon afterwards , Davis switched to the major Columbia record label and recorded seven albums over the next five years w",5,5,0
sent_0294,Several years later the remaining trackage at Charles City was abandoned .,2,1,1
sent_0295,They remained together into their elderly ages for more than 40 years only to marry in 2000 .,3,3,0
sent_0296,"This often results in unexpected deaths , either directly or from stress-induced illness .",3,2,1
sent_0297,The Anti-Monitor began to siphon the positive matter of New York City to create his Antimatter waves .,2,2,0
sent_0298,He became the first code-crosser to play test rugby league for Australia a second time after returning from rugby union ,5,2,3
sent_0299,"The car was based around a Rodeck resleevable , modified Chevrolet 350 ci V8 racing engine coupled to a custom three-spe",5,2,3
sent_0300,The Harford County Public Schools system is the public school system serving the residents of Harford County .,2,1,1
sent_0301,"This work introduced the - fstack-protector flag , which protects only some vulnerable functions , and the - fstack-prot",0,0,0
sent_0302,"In general , the rivalries between all the clubs were friendly , and families were known to switch affiliations dependin",9,5,4
sent_0303,Regulations meant that the original sixth lap would be deleted and the race would be restarted from the beginning of sai,3,0,3
sent_0304,"In the summer , the lodge also houses the Trail Crew , a crew of Dartmouth Outing Club students who help maintain the se",3,2,1
sent_0305,"In Taiwan , the locals speak a version of the Minnan language which is called Taiwanese .",1,1,0
sent_0306,The European powers first gained a foothold in Somalia through the signing of various pacts and agreements with the Soma,6,6,0
sent_0307,Each of these people influenced her development as a person .,3,1,2
sent_0308,"A second factor is resource dependence ; there must be a perceptible threat of resource depletion , and it must be diffi",0,0,0
sent_0309,"Ed drives the creature into the airlock , with the intention of venting it into space .",1,1,0
sent_0310,"In 1970 , Arad moved to the United States and enrolled at Hofstra University to study industrial management .",2,2,0
sent_0311,"Undercover cop Muscles enlists his childhood friends , the `` Five Lucky Stars '' , to travel to Japan to help him catch",4,0,4
sent_0312,They do n't possess eyelids so they must lick their eyeballs clean in order to keep them moist .,5,2,3
sent_0313,"In particular , her grandmother required high standards of behavior from Florence , referring to the family as descendan",2,1,1
sent_0314,"Following the decision to withdraw tram services in London and replace them with buses , the station closed just after 1",2,1,1
sent_0315,"The number of ones equals the number of zeros plus one , since the state containing only zeros can not occur .",2,1,1
sent_0316,"Along with these , there were also commissioners sent to the army , in charge of provisioning the army , policing and fi",11,10,1
sent_0317,The main reason for this adoption over mainline gimp was its support for high bit depths which can be required for film ,2,2,0
sent_0318,"This manual for warriors describes the necessity for understanding an opponent 's weaknesses , for using spies , and for",9,5,4
sent_0319,"Consistent with systems philosophy , systems thinking concerns an understanding of a system by examining the linkages an",3,1,2
sent_0320,"Prior to the war , he was a lawyer , public official , and politician in Hillsborough , North Carolina , and was heavily",6,1,5
sent_0321,"At first , she seems happy with this arrangement .",3,1,2
sent_0322,"Their purpose is to be fair to both parties , disallowing the raising of allegations without a basis in provable fact .",1,1,0
sent_0323,"After a break of four years , he became a Lord Justice of Appeal .",2,2,0
sent_0324,It was only incidentally that economic issues appeared in nationalist political forms .,2,1,1
sent_0325,Other people that can be classified using this title include the Vice President and Cabinet secretaries .,3,3,0
sent_0326,"In 2010 , popular internet reviewers RedLetterMedia delivered a scathing video critique of the film , drawing negative c",3,1,2
sent_0327,"Wild radish seeds contain up to 48 % oil content , and while not suitable for human consumption , this oil is a potentia",1,1,0
sent_0328,"Korean villagers hiding resistance fighters were dealt with harshly , often with summary execution , rape , forced labou",9,1,8
sent_0329,This led morning show host Ryan Cameron to lobby for a frequency change for WHTA by putting together a petition from lis,4,2,2
sent_0330,The Library Board is charged with reviewing the strategic plans of the Harvard Library and assessing its progress in mee,2,2,0
sent_0331,The exhibit premiered at the Helmut Newton Foundation in Berlin and combined the work of all three with personal snapsho,5,4,1
sent_0332,"The Lletty Shenkin explosion of 1849 , in particular , led to demands the local middle classes in Aberdare , for improve",1,1,0
sent_0333,On 1 July 1955 he was made an Officer of the Order of St John .,5,3,2
sent_0334,Ballast tanks are equipped to change a ship 's trim and modify its stability .,3,2,1
sent_0335,"While the infantry based part of the doctrine demanded `` powerful tanks '' and `` tankettes '' , the shock Army demande",1,1,0
sent_0336,Many young South African artists made their debut on LM Radio through the numerous road shows which toured the country .,17,1,16
sent_0337,Lugo and Lozano were released in 1993 and continue to reside in Venezuela .,1,1,0
sent_0338,In the post - `` Gregg '' era Texas has executed over four times more inmates than Virginia and nearly 37 times more inm,3,3,0
sent_0339,High Court judges are therefore referred to as the Honourable Mr/Mrs Justice Smith .,3,2,1
sent_0340,Alexander supposedly said after this incident that he had never been so lucky in his entire career .,2,1,1
sent_0341,"In 1984 , KOMO became the first television station to broadcast daily programming in full stereo sound .",8,4,4
sent_0342,"Joining another fast and mobile carrier task force , `` Hazelwood '' sortied 11 February to protect carriers as they lau",4,1,3
sent_0343,"The city 's population boomed , 5 boroughs were formed , the New York City Subway was opened and became a symbol of prog",3,3,0
sent_0344,Pursuit of the routed enemy to the French border was halted on 2 May upon the German surrender in Italy .,2,1,1
sent_0345,"They believe in God as a single entity , not as the Trinity accepted by the vast majority of Christians .",5,2,3
sent_0346,"Baako 's grandmother Naana , a blind-seer , stands in living contact with the ancestors .",5,1,4
sent_0347,"It was a notable influence on John Buchan and Ken Follett , who described it as `` an open-air adventure thriller about ",4,3,1
sent_0348,"All three had been photography students at The Art Center College of Design in Pasadena , California in 1979 when they b",7,1,6
sent_0349,"Vaccinations against other viral diseases followed , including the successful rabies vaccination by Louis Pasteur in 188",5,2,3
sent_0350,"The oilseed radish grows well in cool climates and , apart from its industrial use , can be used as a cover crop , grown",8,7,1
sent_0351,"In 1840 , he was appointed to command his regiment , a post he held for nearly fourteen years .",8,2,6
sent_0352,"During the latter , Springsteen mentioned he did plan to work with the E Street Band again in the future , but was vague",5,1,4
sent_0353,He left that post to become the second commander of the U.S. Army 's 1st Armored Division .,4,2,2
sent_0354,The town and surrounding villages were hit by two moderate earthquakes within ten years .,6,1,5
sent_0355,"He played 37 times , mainly at right-back , in the 1987-88 season , and scored nine goals - excellent for a player who m",6,3,3
sent_0356,"They held the first Triangle workshop in 1982 for thirty sculptors and painters from the US , the UK and Canada at Pine ",11,5,6
sent_0357,During the 1730s Britain 's relationship with Spain had slowly declined .,2,0,2
sent_0358,KFI helped to keep the calm during the dark days of World War II by airing President Franklin D. Roosevelt 's `` Firesid,2,0,2
sent_0359,Human behavioral ecologists assume that what might be the most adaptive strategy in one environment might not be the mos,4,1,3
sent_0360,"`` My Classical Way '' was released on 21 September 2010 on Marc 's own label , Frazzy Frog Music .",4,1,3
sent_0361,The film uses some computer-generated graphics : The northern lights in the scene where Inge walks through the fields to,2,2,0
sent_0362,"Adnan Latif was in a car accident in 1994 , during which he suffered significant head injuries , which left him with on-",3,3,0
sent_0363,"He accused Maroboduus of hiding in the Hercynian Forest while the other Germans fought for freedom , and accused Marobod",9,2,7
sent_0364,These are known as Porter 's three generic strategies and can be applied to any size or form of business .,2,2,0
sent_0365,"A series of councils were held in 657 , 669 , 846 , 850 , 852 , 853 , 862 , 980 , 986 , 996 , 1048 , 1071 and 1080 .",12,12,0
sent_0366,"Thus , acquisition of quantitative heavy-element spectra can be time-consuming , taking tens of minutes to hours .",6,1,5
sent_0367,"The show was designed to appear as if the viewer was channel surfing through a multi-channel wasteland , happening upon ",4,2,2
sent_0368,Test & official start of the TVN24 HD started on 30 November 2012 .,4,3,1
sent_0369,He served as the first Prime Minister of Australia and became a founding justice of the High Court of Australia .,5,3,2
sent_0370,"The lead single that holds the same name , is a soft melodic song that differs from Tiger JK 's past releases .",3,2,1
sent_0371,"In 1962 , Salahuddin won from Patharghatti assembly seat as an Independent candidate and later from Charminar constituen",7,3,4
sent_0372,"Graner handcuffed him to the bars of a cell window and left him there , feet dangling off the floor , for nearly five ho",11,2,9
sent_0373,Childers 's biographer Andrew Boyle noted : `` For the next ten years Childers 's book remained the most powerful contri,8,5,3
sent_0374,"Like most incarnations , Felicia has a relationship with Spider-Man Noir .",3,3,0
sent_0375,"Plant communities include creosote and sagebrush at lower altitudes , and bristlecone pine forests at higher .",5,5,0
sent_0376,Tom McMorran joined the band in 1994 after Mark Portmann left and in August of that year the band released `` Sahara '' ,6,4,2
sent_0377,"Although in Flanders , the Flemish Region assigned all of its powers to the Flemish Community , the Walloon Region remai",5,2,3
sent_0378,Autostereoscopy is any method of displaying stereoscopic images without the use of special headgear or glasses on the pa,2,1,1
sent_0379,The Chapters of Bremen Cathedral and part of the administration were located within the city boundary in a district of i,7,5,2
sent_0380,The championship was at the Pinehurst Resort where Stewart won his last major championship only a few months before his ,3,1,2
sent_0381,"Necro became a regular member of the PWG roster through the majority of 2008 , teaming with Chris Hero to defend the hon",2,2,0
sent_0382,"They have a large range of possible power supplies , and can be 380V , 1000V , or even higher .",4,4,0
sent_0383,"He played for the Kangaroos in all four matches , including the final , scoring one try .",4,2,2
sent_0384,"There were 22.2 % of families and 23.8 % of the population living below the poverty line , including 15.8 % of under eig",4,3,1
sent_0385,One major difference between the two models is that the Photographic Model follows more of a step-by-step process in the,2,1,1
sent_0386,The Cathedral and the belfry were thoroughly renovated from 2006 to 2008 .,7,3,4
sent_0387,"Darwin came into residence in Cambridge on 26 January 1828 , and matriculated at the University 's Senate House on 26 Fe",5,2,3
sent_0388,"It was united with the Clitheroe Rural District , as part of the Ribble Valley district in the non-metropolitan county o",4,3,1
sent_0389,"One of the prisoners , Kasim Mehaddi Hilas , said that one day he asked Graner for the time so that he could pray .",15,2,13
sent_0390,"Back at the hotel , Taylor went ahead of Lemmy and told him `` Eddie 's left the band '' .",5,3,2
sent_0391,Ed tries to explain what happened to a skeptical Pete .,2,0,2
sent_0392,32.7 % of all households were made up of individuals and 15.7 % had someone living alone who was 65 years of age or olde,3,1,2
sent_0393,A CEN forms an important but small part of a Local Strategic Partnership .,4,0,4
sent_0394,"A Democrat , he became the youngest mayor in Pittsburgh 's history in September 2006 at the age of 26 .",6,2,4
sent_0395,"A cafeteria is also located on the sixth floor , a chapel on the 14th floor , and a study hall on the 15th floor .",3,3,0
sent_0396,"A common name , logo , and programming schedule followed in 1982 , with the establishment of the `` TV8 '' network betwe",4,1,3
sent_0397,A cooling center is a temporary air-conditioned public space set up by local authorities to deal with the health effects,5,2,3
sent_0398,"A manifold is `` prime '' if it can not be presented as a connected sum of more than one manifold , none of which is the",4,2,2
sent_0399,"A mid-March 2002 court order to stop printing for three months , was evaded by printing under other titles , such as `` ",4,2,2
sent_0400,"A motorcycle speedway long-track meeting , one of the few held in the UK , was staged at Ammanford .",3,2,1
sent_0401,A partial list of turbomachinery that may use one or more centrifugal compressors within the machine are listed here .,5,3,2
sent_0402,"A short distance to the east , NC 111 diverges on Greenwood Boulevard .",1,1,0
sent_0403,"A spectrum from a single FID has a low signal-to-noise ratio , but fortunately it improves readily with averaging of rep",9,1,8
sent_0404,"According to Samaritan tradition , however , the Samaritan ethnonym is not derived from the region of Samaria , but from",1,1,0
sent_0405,"According to the 2010 census , the population of the town is 2,310 .",2,2,0
sent_0406,"According to the indictment , Gonzalez is accused of defrauding the West Bronx Neighborhood Association Inc. , a not-for",1,1,0
sent_0407,After 1895 cable hauling ceased and locomotives pulled trains the whole length of the Victoria and Waterloo tunnels .,4,3,1
sent_0408,"After five years of searching , the Colonials found a primitive , lush and vibrant new world and named it Earth .",5,1,4
sent_0409,"After leaving `` Hex '' , Cole went on to appear as Blanche Ingram in the critically acclaimed `` Jane Eyre '' TV serial",2,1,1
sent_0410,"After the battle , Battra rested in the Arctic Ocean , whereas Mothra retired to Infant Island , accompanied by the two ",4,3,1
